{
  "$schema": "http://json-schema.org/draft-07/schema#",
  "title": "ProjectMetadata",
  "type": "object",
  "properties": {
    "name": {
      "type": "string"
    },
    "short": {
      "type": "string"
    },
    "long": {
      "type": "string"
    },
    "tags": {
      "type": "array",
      "items": {
        "type": "string"
      }
    },
    "cover": {
      "type": "string"
    },
    "outLinks": {
      "type": "array",
      "items": {
        "type": "object",
        "properties": {
          "name": {
            "type": "string"
          },
          "url": {
            "type": "string",
            "format": "uri"
          }
        },
        "required": [
          "name",
          "url"
        ]
      }
    },
    "additionalAssets": {
      "type": "array",
      "items": {
        "type": "string"
      }
    },
    "downloadFiles": {
      "type": "array",
      "items": {
        "type": "string"
      }
    },
    "page": {
      "type": "string"
    }
  },
  "required": [
    "name",
    "short",
    "tags",
    "cover",
    "page"
  ]
}
