{
  "name": "John",
  "short": "A Narrative driven, point-and-click game set in Scotland during the 70's.",
  "tags": [
    "Team",
    "School",
    "Unity",
    "2D",
    "Game",
    "C#",
    "PC",
    "Shader"
  ],
  "outLinks": [
    {
      "name": "Itch",
      "url": "https://gluetrap-games.itch.io/john"
    }
  ],
  "cover": "images/cover.png",
  "additionalAssets": [
    "images/a1.png",
    "images/a2.png",
    "images/a3.png",
    "images/a4.png",
    "images/a5.png"
  ],
  "downloadFiles": [
    "files/John.zip"
  ],
  "page": "index.html"
}