{
  "name": "Project Name",
  "short": "A short description of this project.",
  "tags": [
    "Solo",
    "Personal",
    "Unity",
    "3D",
    "Game"
  ],
  "outLinks": [
    {
      "name": "Github",
      "url": "https://github.com/Piotr-Piwoni"
    }
  ],
  "cover": "images/cover.png",
  "additionalAssets": [],
  "downloadFiles": [],
  "page": "index.html"
}