{
  "name": "Test Project",
  "short": "A short description of this test project to show on homepage. A short description of this test project to show on homepage.",
  "tags": [
    "Solo",
    "Personal",
    "Unity",
    "3D",
    "Game",
    "Tool",
    "Feature",
    "Software",
    "TypeScript",
    "JavaScript",
    "C#",
    "C++",
    "Python",
    "Java",
    "GDScript",
    "Rust",
    "Lua",
    "Swift",
    "Kotlin",
    "Ruby",
    "Go",
    "Haskell",
    "C",
    "Objective-C",
    "PHP",
    "Dart",
    "Scala",
    "Perl",
    "Dart",
    "Scala",
    "Perl",
    "PHP",
    "Dart",
    "Scala",
    "Perl",
    "Dart",
    "Scala",
    "Perl"
  ],
  "cover": "cover.png",
  "page": "index.html"
}